{
  "schema_version": "1.0.0",
  "fixture_data": true,
  "revision": 1,
  "material_id": "material_demo_001",
  "product_id": "product_demo_001",
  "product_revision": 1,
  "source_script_id": "script_demo_001",
  "file": {
    "original_name": "工程样例实拍.mp4",
    "mime_type": "video/mp4",
    "sha256": "bbbbbbbbbbbbbbbbbbbbbbbbbbbbbbbbbbbbbbbbbbbbbbbbbbbbbbbbbbbbbbbb",
    "size_bytes": 41000,
    "duration_ms": 6000,
    "width": 360,
    "height": 640,
    "fps": 25,
    "has_audio": true,
    "original_ref": "material_original_demo_001",
    "proxy_ref": "material_proxy_demo_001"
  },
  "archive": {
    "model_name": "样例模特",
    "scene": "室内白墙",
    "shot_date": "2026-08-29",
    "batch": "样例批次A",
    "imported_by": "工程验收",
    "note": "只用于合同测试"
  },
  "processing": {
    "media_task_id": "material_task_demo_001",
    "local_status": "completed",
    "asr_status": "completed",
    "recognition_status": "completed",
    "provider": "fixture-relay",
    "model": "fixture-model",
    "recognized_at": "2026-08-29T09:00:00Z",
    "original_video_uploaded": false
  },
  "clips": [
    {
      "id": "clip_demo_001",
      "source_shot_id": "shot_001",
      "order": 1,
      "start_ms": 0,
      "end_ms": 2500,
      "keyframe_ref": "keyframe_demo_001",
      "transcript": "先看上身效果",
      "purpose_tags": ["hook", "proof"],
      "visual_tags": ["男模特", "正面展示"],
      "garment_views": ["front", "full_body"],
      "action_tags": ["自然站立"],
      "scene_tags": ["室内白墙"],
      "shot_size": "中景",
      "people_count": 1,
      "standalone_usable": true,
      "reusable": true,
      "quality": { "clarity": 86, "stability": 82, "audio": 80, "exposure": 84, "overall": 83 },
      "note": ""
    },
    {
      "id": "clip_demo_002",
      "source_shot_id": "shot_002",
      "order": 2,
      "start_ms": 2500,
      "end_ms": 6000,
      "keyframe_ref": "keyframe_demo_002",
      "transcript": "再看面料纹理",
      "purpose_tags": ["detail"],
      "visual_tags": ["面料特写"],
      "garment_views": ["detail"],
      "action_tags": ["手指轻压面料"],
      "scene_tags": ["室内白墙"],
      "shot_size": "特写",
      "people_count": 0,
      "standalone_usable": true,
      "reusable": true,
      "quality": { "clarity": 90, "stability": 88, "audio": 70, "exposure": 85, "overall": 83 },
      "note": ""
    }
  ],
  "created_at": "2026-08-29T08:59:00Z",
  "updated_at": "2026-08-29T09:00:00Z"
}
